{
  "schemaVersion": 1,
  "taskId": "DEV-900001",
  "producedAt": "2026-08-18T00:00:00Z",
  "producer": "present-lease-broker distributed artifacts",
  "mock": true,
  "provenance": {"source": "mock-adapter", "host": "test"},
  "status": "READY",
  "workflowId": "DEV-900001-workflow",
  "workflowRunId": "wr-aaaaaaaaaaaaaaaaaaaaaaaa",
  "contractHash": "aaaaaaaaaaaaaaaaaaaaaaaaaaaaaaaaaaaaaaaaaaaaaaaaaaaaaaaaaaaaaaaa",
  "admission": {
    "schemaVersion": 1,
    "taskId": "DEV-900001",
    "producedAt": "2026-08-18T00:00:00Z",
    "producer": "present-lease-broker workflow admission",
    "mock": true,
    "provenance": {"source": "mock-adapter", "host": "test"},
    "status": "ADMITTED",
    "workflowId": "DEV-900001-workflow",
    "contractHash": "aaaaaaaaaaaaaaaaaaaaaaaaaaaaaaaaaaaaaaaaaaaaaaaaaaaaaaaaaaaaaaaa",
    "policyPack": {
      "id": "present-default-change",
      "version": 1,
      "registryHash": "bbbbbbbbbbbbbbbbbbbbbbbbbbbbbbbbbbbbbbbbbbbbbbbbbbbbbbbbbbbbbbbb",
      "riskClass": "normal",
      "status": "SATISFIED"
    }
  },
  "workflowDag": {
    "schemaVersion": 1,
    "taskId": "DEV-900001",
    "producedAt": "2026-08-18T00:00:00Z",
    "producer": "present-lease-broker workflow DAG",
    "workflowId": "DEV-900001-workflow",
    "workflowRunId": "wr-aaaaaaaaaaaaaaaaaaaaaaaa",
    "contractHash": "aaaaaaaaaaaaaaaaaaaaaaaaaaaaaaaaaaaaaaaaaaaaaaaaaaaaaaaaaaaaaaaa",
    "maxParallel": 1,
    "nodes": [],
    "edges": []
  },
  "workflowDagPath": "/tmp/workflow-dag.json",
  "workflowPath": "/tmp/workflow.json",
  "evidenceManifest": {},
  "evidenceGraph": {
    "schemaVersion": 1,
    "taskId": "DEV-900001",
    "producedAt": "2026-08-18T00:00:00Z",
    "producer": "present-lease-broker evidence graph",
    "workflowId": "DEV-900001-workflow",
    "workflowRunId": "wr-aaaaaaaaaaaaaaaaaaaaaaaa",
    "contractHash": "aaaaaaaaaaaaaaaaaaaaaaaaaaaaaaaaaaaaaaaaaaaaaaaaaaaaaaaaaaaaaaaa",
    "nodes": [],
    "redactionStatus": "CLEAN",
    "gateDecision": "ACCEPTED"
  },
  "evidenceGraphPath": "/tmp/evidence-graph.json",
  "redactionReport": {},
  "replayReport": {
    "schemaVersion": 1,
    "taskId": "DEV-900001",
    "producedAt": "2026-08-18T00:00:00Z",
    "producer": "present-lease-broker replay reporter",
    "workflowId": "DEV-900001-workflow",
    "workflowRunId": "wr-aaaaaaaaaaaaaaaaaaaaaaaa",
    "contractHash": "aaaaaaaaaaaaaaaaaaaaaaaaaaaaaaaaaaaaaaaaaaaaaaaaaaaaaaaaaaaaaaaa",
    "reusedNodes": [],
    "freshNodes": [],
    "invalidatedNodes": [],
    "skippedNodes": []
  },
  "replayReportPath": "/tmp/attempt-replay.json",
  "artifactProvenance": {
    "schemaVersion": 1,
    "taskId": "DEV-900001",
    "producedAt": "2026-08-18T00:00:00Z",
    "producer": "present-lease-broker artifact provenance",
    "workflowId": "DEV-900001-workflow",
    "workflowRunId": "wr-aaaaaaaaaaaaaaaaaaaaaaaa",
    "contractHash": "aaaaaaaaaaaaaaaaaaaaaaaaaaaaaaaaaaaaaaaaaaaaaaaaaaaaaaaaaaaaaaaa",
    "artifacts": []
  },
  "artifactProvenancePath": "/tmp/artifact-provenance.json",
  "acceptanceManifest": {
    "schemaVersion": 1,
    "taskId": "DEV-900001",
    "producedAt": "2026-08-18T00:00:00Z",
    "producer": "present-lease-broker deterministic acceptance",
    "workflowId": "DEV-900001-workflow",
    "workflowRunId": "wr-aaaaaaaaaaaaaaaaaaaaaaaa",
    "contractHash": "aaaaaaaaaaaaaaaaaaaaaaaaaaaaaaaaaaaaaaaaaaaaaaaaaaaaaaaaaaaaaaaa",
    "decision": "ACCEPTED",
    "reason": "fixture accepted",
    "acceptedEvidence": []
  },
  "acceptanceManifestPath": "/tmp/acceptance-manifest.json",
  "retentionPolicy": {
    "class": "standard",
    "ttlSeconds": 604800,
    "redactionRequired": true,
    "purgeOnCompletion": false
  },
  "handoffPackage": {},
  "handoffPath": "/tmp/handoff-package.json",
  "handoffSha256": "cccccccccccccccccccccccccccccccccccccccccccccccccccccccccccccccc"
}
